<?xml version="1.0" ?>
<!DOCTYPE test-script SYSTEM "http://www-x.antd.nist.gov:8080/p25/issi-emulator/dtd/testscript.dtd">
<test-script
	testCompletionDelay="10"
>

<group-call-setup-scenario
	id="group-call-setup-scenario-1"
	callingSuName="callingSuA"
	calledGroupName="calledGroup"
	isConfirmed="false"
	priority="4"
>
<trigger
	type="time"
	value="6"
/>
</group-call-setup-scenario>

<su-script
	id="suscript2"
	suName="callingSuA"
	method="doSendTalkSpurt"
	description="Send a talk spurt to the group. "
>
<trigger
	type="time"
	value="10"
/>
<script>
def doSendTalkSpurt():
	global su
	su.setTransmitPriority("NORMAL",4)
	su.sendTalkSpurt("calledGroup")
</script>
</su-script>

<su-script
	id="suscript3"
	suName="calledSuB"
	method="doSendTalkSpurt"
	description="Send a talk spurt to the group at a higher priority."
>
<!-- type="ptt_message" value="PTT_PROGRESS" oneShot="true" -->
<trigger
	type="time"
	value="11"
/>
<script>
def doSendTalkSpurt():
	global su
	su.sendMute("calledGroup")
	su.sendUnmute("calledGroup",1500)
</script>
</su-script>

</test-script>
