<?xml version="1.0" ?>
<!DOCTYPE test-script SYSTEM "http://www-x.antd.nist.gov:8080/p25/issi-emulator/dtd/testscript.dtd">
<test-script
	traceGenerationTime="10"
	testCompletionDelay="10"
	generatePttTrace="yes"
>

<group-call-setup-scenario
	id="group-call-setup-scenario-2"
	callingSuName="callingSu"
	calledGroupName="calledGroup"
	isProtected = "true"
	priority="8"
	isEmergency="false"
	cancelAfter="1"
>
<trigger
	type="time"
	value="3"
/>
</group-call-setup-scenario>

<group-call-setup-scenario
	id="confirmed-group-call-setup"
	callingSuName="callingSu"
	calledGroupName="calledGroup"
	isConfirmed="true"
	priority="4"
	isTalkSpurtSentAfterCallSetup="true"
	isTalkSpurtForced="true"
>
<trigger
	type="time"
	value="5"
/>
</group-call-setup-scenario>

<rfss-script	
	id="rfss-script"
	rfssName="rfss_1"
	method="doChangeGroupPriority"
	description="Re Invite from group home at a higher priority of 8; emergency=true "
>
<trigger
	type="time"
	value="10"
/>
<script>
def doChangeGroupPriority():
	global rfss 
	rfss.changeGroupCallPriority("calledGroup",8,"emergency")	
</script>
</rfss-script>

<rfss-script
	id ="rfss-script"
	rfssName="rfss_1"
	method="removeRtpResources"
	description="Remove RTP resources from this RFSS"
>
<trigger
	type="time"
	value="10"
/>
<script>
def removeRtpResources() :
	rfss.removeRtpPort(3)
</script>
</rfss-script>

<su-script
	id="suscript3"
	suName="callingSu"
	method="doSendTalkSpurt"
	description="Start a talk long (3 minute) spurt to the group a second later send a higher priority talk spurt from this Rfss. "
>
<trigger
	type="time"
	value="8"
/>
<script>
def doSendTalkSpurt():
	global su
	su.setTransmitPriority("NORMAL",4)
	su.sendTalkSpurt("calledGroup")
</script>
</su-script>

<su-script
	id="suscript4"
	suName="higherPrioritySu"
	method="doSendTalkSpurt"
	description="Send a short higher priority talk spurt to the group from the served Rfss. "
>
<trigger
	type="time"
	refId="suscript3"
	value="1"
/>
<script>
def doSendTalkSpurt():
	global su
	su.setTransmitPriority("NORMAL",8)
	#send only 5 blocks so we send an end and the other
	# stream has a chance to unmute
	su.sendTalkSpurt("calledGroup",5)

</script>
</su-script>

<roaming-scenario
	id="roamingScenario"
	suName="mySu"
	destinationRfssName="targetRfss"
>
<trigger
	type="time"
	value="5"
/>
</roaming-scenario>
<roaming-scenario
	id="roaming-scenario-1"
	suName="roamingSu"
	destinationRfssName="targetRfss" 
	delay="3"
>
<trigger
	type="time"
	value="10"
/>
</roaming-scenario>

<su-to-su-call-setup-scenario
	id="su-to-su-call-0"
	callingSuName="callingSu"
	calledSuName="calledSu"
	terminateAfter = "5"
	isProtected = "true"
>
>
<trigger
	type="time"
	value="5"
/>
</su-to-su-call-setup-scenario>
<su-to-su-call-setup-scenario
	id="su-to-su-call-0"
	callingSuName="callingSu"
	calledSuName="calledSu"
	talkSpurtSentBy="callingSu"
	isTalkSpurtForced="true"
	terminateAfter="10"
	isTerminatedByCalledServing="true"
>
<trigger
	type="time"
	value="5"
/>
</su-to-su-call-setup-scenario>

</test-script>

